{
  "version": 1,
  "decision_status": "approved",
  "methodology_version": "2.1F-design-candidate",
  "issue": "https://github.com/usdimpact/usd-impact-pipeline/issues/224",
  "design_merge_commit": "e14aec35142b9536b5b889d0fae4eab9a94faf88",
  "preregistration_merge_commit": "bcf473e2bbcb36fa1080a3a56f77a3796d74ccaa",
  "execution_scope": "live_historical_vintage_feasibility_preflight_only",
  "exact_series": [
    "H10/H10/JRXWTFB_N.B",
    "WPU0561",
    "H8/H8/B1001NCBA",
    "H41/H41/RESPPALDP_N.WW",
    "H41/H41/RESPPA_N.WW"
  ],
  "data_window": {
    "start": "2013-01-01",
    "end": "2026-10-23"
  },
  "storage_policy": {
    "source_values": "ephemeral_only",
    "raw_responses": "ephemeral_only",
    "temporary_workspace": "isolated_non_public",
    "durable_private_storage": false
  },
  "output_policy": {
    "source_values_in_logs": false,
    "component_values_in_logs": false,
    "candidate_score_output": false,
    "public_repo_source_values": false,
    "allowed_persistent_outputs": [
      "aggregate_feasibility_status",
      "aggregate_release_counts",
      "release_identifiers_without_values",
      "non_value_bearing_hashes"
    ]
  },
  "authorizations": {
    "real_data_fetch": true,
    "live_vintage_preflight": true,
    "real_data_research": false,
    "candidate_score_computation": false,
    "paid_data": false,
    "source_contract_acceptance": false,
    "research_ledger_mutation": false,
    "public_artifact_replacement": false,
    "production": false
  },
  "approved_by": "usdimpact owner via Issue #224 approval comment 6479715940",
  "approved_at": "2026-10-28T20:20:28Z",
  "notes": "Explicit owner approval recorded in Issue #224 comment 6479715940. Stage 1 only: live historical-vintage feasibility preflight for 2013-01-01 through 2026-10-23, exact five preregistered series, official Federal Reserve Board/BLS sources only, ephemeral source data, no candidate Score computation, no full research, no Production."
}
